rotten_tomatoes_link,critic_name,top_critic,publisher_name,review_type,review_date,review_content
m/renfield,Barry Hertz,TRUE,Globe and Mail,Rotten,4/13/2023,"Feel free to expose Renfield to direct sunlight, and watch it burn."
m/renfield,Mark Dujsik,FALSE,Mark Reviews Movies,Rotten,4/13/2023,"A good idea is never enough to sustain an entire movie, which is why Renfield is far more disappointing than anything else."
m/renfield,Rendy Jones,FALSE,Rendy Reviews,Rotten,4/13/2023,Renfield prospers from Nic Cage and Nicholas Hoult biting down on their distinctive charisma supplying blood to this stylized horror comedy. But the lack of meat within the characters and story prevents it from reaching the height of its unholy potential.
m/renfield,Kimberley Elizabeth,FALSE,Nightmare on Film Street,Fresh,4/13/2023,"Combining deviously fantastical fight sequences, a fiercely fresh take on an unexplored branch of Dracula lore, and downright inspired casting, [Renfield] is a sinister spectacle to behold."
m/renfield,Travis Hopson,FALSE,Punch Drunk Critics,Fresh,4/13/2023,"If you're coming to Renfield, you're coming to see Cage as the lord of all bloodsuckers, and he doesn't disappoint."
m/renfield,Aaron Neuwirth,FALSE,We Live Entertainment,Fresh,4/13/2023,"Thanks to a wickedly unhinged performance from Nicolas Cage and reliable work from most of the other stars, this incredibly gory vampire comedy provides a fun enough take on the Prince of Darkness'and the one who does his bidding."
m/renfield,Jim Slotek,FALSE,Original Cin,Fresh,4/13/2023,"It's an interesting set-up, but it's no What We Do in the Shadows. Nic plays Drac with gusto, paying tribute to past incarnations like Lugosi and Lee. The editing is quick, the quips fly, and severed limbs and gore fill the screen. A guilty pleasure."
m/renfield,Brianna Zigler,FALSE,Paste Magazine,Rotten,4/13/2023,"Whenever Cage is on screen, Renfield's a gas. But he so overwhelmingly steals the show from the character who is bafflingly made to be our protagonist that the scenes without Cage take the air from the room."
m/renfield,Clint Worthington,FALSE,The Spool,Rotten,4/13/2023,"If Renfield had committed to this premise, a deep dive into Renfield's codependency with his demonic master [...] it'd be a dark horror delight. But alas, McKay (and screenwriter Ryan Ridley) have seemingly been bitten by a radioactive Mark Millar."
m/renfield,Maria Lattila,FALSE,WhyNow (UK),Fresh,4/13/2023,"Renfield is enjoyable but ultimately a little forgettable. While most of the jokes land, some of them feel recycled, and they lack wit."
m/renfield,Richard Crouse,FALSE,Richard Crouse,Fresh,4/13/2023,"Perhaps an alternate title for Renfield might have been Dracula: I'm OK, You're OK. A mix of Bram Stoker and group therapy pioneer Joseph H. Pratt, it is a modern interpretation of the Dracula legend that doesn't take itself seriously."
m/renfield,Nikki Baughan,FALSE,Screen International,Fresh,4/13/2023,"Cage's full-tilt, high-camp Dracula steals the show. That raises the stakes in a film which otherwise relies heavily on snappy editing, lavish effects and relentlessly ironic humour to paper over a clunky and underwritten story."
m/renfield,Richard Roeper,TRUE,Chicago Sun-Times,Fresh,4/13/2023,An uneven but entertaining enough vampire comedy that gets as many laughs from creative slicing and dicing than it does from the dialogue.
m/renfield,Sherin Nicole,FALSE,Geek Girl Riot,Rotten,4/13/2023,Making this movie must have been a better time than Mardi Gras on New Year's Eve. And it shows. Renfield is relentless madness in a spinning tilt-a-whirl of blood-gushing death BUT with giggles.
m/renfield,Kat Hughes,FALSE,THN,Fresh,4/13/2023,"An entertaining blend of horror, comedy, and action with some great performances all round. Sure to be a crowd-pleaser Renfield is a disarmingly charming, explosively gory, and wickedly funny."
m/renfield,Stephanie Malone,FALSE,Morbidly Beautiful,Fresh,4/13/2023,"Nicolas Cage is every bit as enthralling as Dracula as you would expect and hope, but he's not the only reason to buy a ticket to this wildly entertaining, exceedingly bloody, genre-bending horror-comedy-action-romance."
m/renfield,Lee McCoy,FALSE,DrumDums,Fresh,4/13/2023,Renfield deliciously sinks its teeth in due to the ever chameleon Nicolas Cage (who hilariously gives his all) and an electric cast of young talent led by Nicolas Hoult and Awkwafina.
m/renfield,Cary Darling,TRUE,Houston Chronicle,Rotten,4/13/2023,"If not for (Nicolas Cage and Nicholas Hoult's) chemistry and screen presence, Renfield wouldn't have much to sink its teeth into."
m/renfield,Brian Eggert,FALSE,Deep Focus Review,Rotten,4/13/2023,Unsatisfying as a whole and downright disappointing for wasting a terrific Cage performance on a lackluster movie. 
m/renfield,Matt Donato,FALSE,IGN Movies,Fresh,4/13/2023,"Renfield makes a mess of its story at times, but does a good enough job getting gorgeously gruesome with its vampire action sequences to win us over with cartoonish gore '“ and Nicolas Cage's Dracula is one for the ages."
m/renfield,Brian Orndorf,FALSE,Blu-ray.com,Fresh,4/13/2023,"McKay and Ridley try to merge action cinema with an absolute bloodbath, delivering a highly bizarre and periodically electric endeavor."
m/renfield,Bob Strauss,TRUE,San Francisco Chronicle,Rotten,4/12/2023,Renfield' is the kind of project where you just have to pick out elements to enjoy and suffer through the rest.
m/renfield,Kevin A. Ranson,FALSE,MovieCrypt.com,Fresh,4/12/2023,"The heartbeat of the film is the Nicholases: Hoult & Cage... a spiritual R-rated sequel to the original Universal Dracula... the monster everyone knows he can be. Even when mortal wounds can be supernaturally shrugged off, words can still cut the deepest."
m/renfield,Rob Thomas,FALSE,"Capital Times (Madison, WI)",Rotten,4/12/2023,"Every moment of Cage hamming it up in a cape with a mouthful of needle-sharp teeth is fantastic. Unfortunately, those moments are too rare in a movie that for some reason is stuffed with 'John Wick'-style fight scenes that Cage isn't even in."
m/renfield,Annie Banks,FALSE,Chuck Load of Comics,Rotten,4/12/2023,"While Renfield doesn't suck, it could use more bite."
m/renfield,Kate Erbland,TRUE,indieWire,Rotten,4/12/2023,"All stuff that sounds fun on paper, but is utterly limp in execution. There's nothing juicy here, nothing really new, a bloodless spin on what should have been a tasty new take."
m/renfield,Jake Coyle,TRUE,Associated Press,Fresh,4/12/2023,Renfield is enjoyable enough in a disposable sort of way. A lack of self-seriousness is a quality to be appreciated in any movie like this. And Hoult manages to be remarkably sweet while at the same time using human limbs to decapitate other victims.
m/renfield,Scott Davis,FALSE,HeyUGuys,Fresh,4/12/2023,"While it feels undercooked and unrefined, there's no denying Renfield is a funny, enjoyable romp fuelled by Hoult and Cage, the latter at his most delectable and intoxicating as the Prince of Darkness."
m/renfield,A.A. Dowd,TRUE,Chron,Rotten,4/12/2023,"An off-putting multiplex monstrosity, mixing glib action-movie splatter with therapy speech."
m/renfield,Anton Bitel,FALSE,SciFiNow,Fresh,4/12/2023,Chris McKay's therapeutic horror comedy lets its side character find his centre while trying to free himself from a monstrous partner.
m/renfield,Michael Phillips,TRUE,Chicago Tribune,Rotten,4/12/2023,May the next outing with Renfield and Dracula... be a little funnier and a little less too much.
m/renfield,Ann Hornaday,TRUE,Washington Post,Fresh,4/12/2023,"It's hard to hold anything against a silly, 90-minute-long pulp-fest that gets in some sick burns about ska music and crappy bosses."
m/renfield,Brian Truitt,TRUE,USA Today,Rotten,4/12/2023,Nicolas Cage is dead and loving it. If only the rest of 'Renfield' had as much campy bite.
m/renfield,Dylan Roth,TRUE,Observer,Rotten,4/12/2023,It feels like a superhero movie wearing a horror movie's hand-me-downs.
m/renfield,EJ Moreno,FALSE,Flickering Myth,Fresh,4/12/2023,The great chemistry between Hoult and Cage elevates this average horror comedy to a deliciously gory good time.
m/renfield,Laura Clifford,FALSE,Reeling Reviews,Rotten,4/12/2023,Writer Ryan Ridley and director Chris McKay ('The Lego Batman Movie) squander their fabulous dual Nicolas leads with a mediocre vampire/crime thriller crossover that cannot hold a candle to TV's '˜What We Do in the Shadows.'
m/renfield,Robert Kojder,FALSE,Flickering Myth,Rotten,4/12/2023,It is a shame everything surrounding Renfield'˜s central concept sucks
m/renfield,Daniel Bayer,FALSE,AwardsWatch,Fresh,4/12/2023,"Whenever [Cage is] on screen Renfield is a deranged delight, but whenever he's not, it mostly sags."
m/renfield,Gavia Baker-Whitelaw,FALSE,The Daily Dot,Fresh,4/12/2023,"It's easy viewing, which isn't something you can say of many films involving this much gore and severed limbs."
m/renfield,Aaron White,FALSE,Feelin' Film Podcast,Rotten,4/12/2023,"Bloody, amusing, and completely empty. Cage is a riot when he's on screen and the action is gory fun, but when those two things aren't in focus the film really suffers."
m/renfield,Meagan Navarro,TRUE,Bloody Disgusting,Fresh,4/12/2023,"McKay's tribute to horror charms, while his creative use of gore elicits the film's biggest laughs. It's a breezy, low-stakes, and effortless watch, though anemic in its storytelling."
m/renfield,Mae Abdulbaki,FALSE,Screen Rant,Fresh,4/12/2023,"There is still fun to be had & Renfield is goofy, with fantastic action sequences & a few comedic beats that land, but it could've been so much more."
m/renfield,Swara Salih,FALSE,But Why Tho? A Geek Community,Rotten,4/12/2023,"Renfield is regrettably a mediocre bore of a movie. While there are a few good performance among the cast, especially from Nicolas Cage's Dracula, and some good action and violence, the shoddily written script sinks it into a boring time at the theaters."
m/renfield,Matt Oakes,FALSE,Silver Screen Riot,Rotten,4/12/2023,"Renfield makes its 90-minute runtime feel like a small eternity, an ironic feat for a movie about having to endure an endless, purposeless existence."
m/renfield,Jake Cole,TRUE,Slant Magazine,Rotten,4/12/2023,The film frustratingly shrouds Nicholas Cage's manic intensity in thick blankets of winking irony.
m/renfield,Siddhant Adlakha,FALSE,Polygon,Rotten,4/12/2023,"Renfield is bad in a way too many big studio movies are bad, yet it proves to be one of the worst examples of a self-reflexive, pop-culture-referencing modern 'property' that plays like a hollow impression of something better."
m/renfield,Chris Evangelista,FALSE,Slashfilm,Rotten,4/12/2023,"Nicolas Cage's Dracula deserves a better movie, and so do we."
m/renfield,Lucy Buglass,FALSE,What To Watch,Fresh,4/12/2023,"Cage shines as an exaggerated Prince of Darkness opposite Hoult's tender, self-reflective Renfield who just wants freedom."
m/renfield,Jamie Graham,FALSE,Total Film,Fresh,4/12/2023,"While it hardly stays with you like The Invisible Man, Renfield is a fun Friday night at the movies."
m/renfield,Bill Goodykoontz,TRUE,Arizona Republic,Rotten,4/12/2023,"The actors are having fun here and, for a while, so will the audience. But the payoff just isn't there."
m/renfield,Ellen E Jones,TRUE,Guardian,Fresh,4/12/2023,Renfield efficiently sucks only the best and bloodiest lore from decades of Hollywood monster movies.
m/renfield,Eddie Harrison,FALSE,film-authority.com,Fresh,4/12/2023,˜'Cage and co manage to make this version of the Count a bloody entertaining action comedy''
m/renfield,Mike Massie,FALSE,Gone With The Twins,Fresh,4/12/2023,"The pacing is off in a couple of spots, but the attention to humorously horrific carnage remains front and center."
m/renfield,Joey Magidson,FALSE,Awards Radar,Rotten,4/12/2023,Renfield offers up Nicolas Cage's hilarious Dracula alongside far less appealing police procedural elements.
m/renfield,Jeanne Kaplan,FALSE,Kaplan vs. Kaplan,Fresh,4/12/2023,"This overtly campy ode to the undead is definitely different, mostly amusing and highly entertaining."
m/renfield,David Kaplan,FALSE,Kaplan vs. Kaplan,Fresh,4/12/2023,This film is not for the squeamish unless one accepts that the fake blood that gushes as heads explode and limbs are ripped off is just that --- fake. It is all so absurd you can only laugh about it.
m/renfield,Katie Walsh,TRUE,Tribune News Service,Fresh,4/12/2023,"Renfield' dutifully delivers the goods '” and a few therapist-approved lessons about codependent relationships too '” but unfortunately, it's lacking a bit of bite."
m/renfield,Carla Hay,FALSE,Culture Mix,Fresh,4/11/2023,"Nicolas Cage's campy performance as Dracula is the best thing about Renfield, a horror comedy that sometimes gets a little too one-note and manic for its own good. The movie doesn't take itself seriously, and neither should viewers."
m/renfield,Kyle Anderson,FALSE,Nerdist,Rotten,4/11/2023,"Even the delightfully gruesome set pieces and Nicolas Cage's Dracula mastery can't make Renfield more than a very dumb, not-funny comedy, a not-scary horror movie, and a not-exciting action movie."
m/renfield,Frank Scheck,TRUE,The Hollywood Reporter,Rotten,4/11/2023,Anemic.
m/renfield,Brian Lloyd,FALSE,entertainment.ie,Rotten,4/11/2023,"'Renfield' lacks teeth, but it's got Nicolas Cage and that's enough."
m/renfield,Avi Offer,FALSE,NYC Movie Guru,Rotten,4/11/2023,"A repetitive, exhausting and lazy misfire that sorely lacks wit, campiness and imagination. At least Nicolas Cage has fun sinking his teeth into the role of Dracula."
m/renfield,Sean Mulvihill,FALSE,Mulviews,Rotten,4/11/2023,Whatever movie Nicolas Cage thought he was making is the movie that I would like to see. Too bad it's not whatever Renfield is.
m/renfield,Matthew Lickona,TRUE,San Diego Reader,Fresh,4/11/2023,"Robert Kirkman's story takes its pop psychology seriously, which is what makes its application here so much fun. When Cage bellows, 'I'm the real victim here!' anyone who's ever known a narcissist may find themselves wincing through the grin."
m/renfield,Moira MacDonald,TRUE,Seattle Times,Rotten,4/11/2023,"Even with its brief running time, the movie runs out of steam too quickly, and Awkwafina's character in particular seems like a first draft."
m/renfield,Mike Scott,FALSE,Times-Picayune,Fresh,4/11/2023,A gorefest of gleefully cartoonish proportions.
m/renfield,Owen Gleiberman,TRUE,Variety,Rotten,4/11/2023,"Renfield... has no mystery, no poetry, no grandeur. It's a scattershot lark jam-packed with ideas, none of which really take hold."
m/renfield,Casey Chong,FALSE,Casey's Movie Mania,Fresh,4/11/2023,Renfield has enough brutal fun of genre mishmash to keep one occupied throughout its 93-minute length.
m/renfield,Jeff Nelson,FALSE,Showbiz Cheat Sheet,Fresh,4/11/2023,"Renfield instills a fresh twist to the dynamic between Dracula and his familiar, packed with enough blood to please the Dark One himself."
m/renfield,David Poland,FALSE,Hot Button,Fresh,4/11/2023,It would be really easy to oversell Renfield. But it's a really great time if you are up for this kind of ride. I might suggest that it is the best of the 2023 Universal Trilogy Of Fun Violence.
m/renfield,Fred Topel,FALSE,United Press International,Fresh,4/11/2023,"Cage also turns on the menace. This Dracula is not a buffoon. He's still as dangerous as the Dracula adapted from Bram Stoker, albeit far more graphic than 1931 films could portray."
m/renfield,Kristen Lopez,TRUE,TheWrap,Fresh,4/10/2023,Renfield' is a great example of how Universal could resurrect its Dark Universe. Take tangential characters or questions audiences have wondered about and find a way to actually explore them.
m/renfield,Jorge Loser,FALSE,Espinof,Fresh,4/10/2023,"Renfield is silliness full of explosive gore, with tropes from the '80s - 90s buddy movies and agile editing that makes its 90 minutes fly by..."
m/renfield,Carson Timar,FALSE,Clapper,Fresh,4/9/2023,It is hard to imagine many going to see Renfield and not finding at least a few solid laughs.
m/renfield,Dan Scully,FALSE,ScullyVision,Fresh,4/7/2023,"Proves to be a broadly pleasing, remarkably safe studio comedy. This isn't necessarily a bad thing so much as it's a case of squandered potential."
m/renfield,Liam Crowley,FALSE,ComicBook.com,Fresh,4/6/2023,"While it is no groundbreaking Dracula story, Renfield is a genuinely hilarious twist on the all-too-familiar vampire narrative. The R-rated comedy genre and Universal's monster sandbox have been begging for a new classic. This delivers across the board."
m/renfield,Matthew Monagle,FALSE,The Playlist,Fresh,4/5/2023,"In Nicolas Cage's hands, Dracula is the perfect marriage between the rock star and the jilted lover."
m/renfield,Mike Reyes,FALSE,CinemaBlend,Fresh,4/4/2023,[T]he acting dance that Cage and Nicholas Hoult do on screen provides a strong core that allows Renfield to take all of the swings audiences could want.
m/renfield,Sam Stone,FALSE,CBR,Fresh,4/3/2023,"Nicolas Cage takes on the role Dracula in Renfield, with the horror comedy leaning into self-aware humor and bloody thrills in equal measure."
m/renfield,Rachel Leishman,FALSE,The Mary Sue,Fresh,3/31/2023,"Luckily, director Chris McKay and screenwriters Ryan Ridley and Robert Kirkman really made this a perfect nod to the Universal monsters we know and love -- and a deeper look into toxic relationships and the pain they bring to everyone involved."
m/renfield,Liz Shannon Miller,TRUE,Consequence,Fresh,3/31/2023,"Renfield knows exactly what it wants to achieve and does so effectively, anchored by its lead performances and some very enjoyable super-violent action sequences which earn its R rating honestly."
m/renfield,Maggie Boccella,FALSE,Collider,Fresh,3/31/2023,"It's peak horror-comedy, much more American Werewolf in London than Bram Stoker's Dracula, and ultimately it's fun primarily because it doesn't commit too hard to any one thing."
m/renfield,Kim Newman,TRUE,Empire Magazine,Fresh,3/31/2023,"It's a horror-comic orgy of gore, with any number of bad guys torn to pieces, but occasionally pauses for poignant moments about the life Renfield lost by submitting to his master and unusual spins on vampire lore."
m/renfield,Edward Douglas,FALSE,The Weekend Warrior (Substack),Rotten,3/31/2023,"How this dreadful movie slipped past the normally keen folks at Universal, who can generally discern if they're making a movie that's good, bad, or '“ as is this case '“ HORRIBLE '“ is indeed a stumper to me. "
m/renfield,Tessa Smith,FALSE,Mama's Geeky,Fresh,3/31/2023,"It delivers on a great time at the movies. Packed with insanity, action, humor, blood, and gore, this is one you soon won't forget."
m/renfield,Matt Neglia,FALSE,Next Best Picture,Fresh,3/31/2023,"The laughs in Renfield may be inconsistent, but the buckets of blood never stop flowing."
m/humanist_vampire_seeking_consenting_suicidal_person,Milana Vujkov,FALSE,Lola On Film,Fresh,11/30/2024,"A dented but delightful genre upgrade, steering the archetypal tale of undead bloodsuckers into comfortable Addams Family territory  then radicalising it with a daring Nietzschean twist."
m/humanist_vampire_seeking_consenting_suicidal_person,Jason Shawhan,FALSE,Nashville Scene,Fresh,11/8/2024,Sasha getting her fangs is very relatable to anyone who spent years at the mercy of biochemistry and autonomic nervous responses.
m/humanist_vampire_seeking_consenting_suicidal_person,Margot Harrison,FALSE,Seven Days (VT),Fresh,10/30/2024,"But the acting, script and cinematography still make Humanist Vampire an experience perfect for anyone whose gothic whimsy itch wasn't sufficiently scratched by Beetlejuice Beetlejuice."
m/humanist_vampire_seeking_consenting_suicidal_person,Graeme Tuckett,FALSE,Stuff.co.nz,Fresh,10/9/2024,"A funny, sweet and happily transgressive wee film. At times it reminded me of Wes Anderson's Moonrise Kingdom, but without the polish and the distracting big names, and often it seemed to be riffing on a whole generation of 80s American teen comedies."
m/humanist_vampire_seeking_consenting_suicidal_person,Cath Clarke,TRUE,Guardian,Fresh,10/9/2024,"All round the film has less bite than you'd expect. But it's stylishly shot by first-timer Louis-Seize, a bit reminiscent of an early Jim Jarmusch movie with its deadpan sense of humour, never trying too hard, just a little bit too cool for school."
m/humanist_vampire_seeking_consenting_suicidal_person,Andrew Wyatt,FALSE,The Take-Up,Fresh,10/1/2024,"A creepy, funny, and tender-hearted take on a frequently stale subgenre. One of the better and most original vampire films in a decade."
m/humanist_vampire_seeking_consenting_suicidal_person,Rebecca Johnson,FALSE,Movie Marker,Fresh,9/9/2024,"With a strong coming-of-age storyline at its heart, laugh-out-loud comedy and plenty of blood spilled, Humanist Vampire is a fun, endearing humour/horror hybrid that's one of the most unique of the year."
m/humanist_vampire_seeking_consenting_suicidal_person,Jonathan W. Hickman,FALSE,The Newnan Times-Herald,Fresh,8/23/2024,Director and co-writer Ariane Louis-Seize plays with our built-in prejudices against these dark beings and finds a semblance of humanity. The result is an often funny production approaching a singular profundity in its closing moments.
m/humanist_vampire_seeking_consenting_suicidal_person,Sebastian Zavala Kahn,FALSE,Cinencuentro,Fresh,8/11/2024,"It manages to mix black humour with some violence and a lot of teenage drama, to give us a very different experience from what we usually have with other horror or suspense productions. ."
m/humanist_vampire_seeking_consenting_suicidal_person,Sean P. Means,FALSE,The Movie Cricket,Fresh,8/2/2024,"The pairing of Montpetit and Benard brings out the story's edgy quirks, as the two shy characters spark in unexpected and quietly moving ways."
m/humanist_vampire_seeking_consenting_suicidal_person,Gisela Savdie,FALSE,El Heraldo,Fresh,7/14/2024,"Instead of delving into horror, the movie uses an ironic and poetic tone that blends drama with dark humor. "
m/humanist_vampire_seeking_consenting_suicidal_person,Andy Klein,FALSE,FilmWeek (KPCC - NPR Los Angeles),Fresh,7/13/2024,"It's quite enjoyable, witty and low-key."
m/humanist_vampire_seeking_consenting_suicidal_person,Justina Walford,FALSE,AWFJ.org,Fresh,7/11/2024,"A perfect cocktail of sweet teen innocence, old vampire family quirks, and blood! While the outcome is predictable, the fun is in taking the ride to the end."
m/humanist_vampire_seeking_consenting_suicidal_person,Lauren Coates,TRUE,Chicago Reader,Fresh,7/10/2024,"This French vampire dramedy may not be groundbreaking, but its strong leads and dry humor make it well worth watching."
m/humanist_vampire_seeking_consenting_suicidal_person,Steven Prokopy,FALSE,Third Coast Review,Fresh,7/6/2024,Director/co-writer Ariane Louis-Seize has a subtle touch for creating characters who reach our heart even when they're talking about death and bloodsucking.
m/humanist_vampire_seeking_consenting_suicidal_person,Sarah Vincent,FALSE,Sarah G Vincent Views,Fresh,7/4/2024,Humanist Vampire Seeking Consenting Suicidal Person is an unexpected delight about misfits finally embracing themselves and finding joy in each other without sacrificing the innate brutality of vampires.
m/humanist_vampire_seeking_consenting_suicidal_person,Aaron Neuwirth,FALSE,We Live Entertainment,Fresh,6/28/2024,"It's the latest in a line of genre films focused on young women coming of age that I've seen in recent weeks, following Inside Out 2 and Tiger Stripes. I enjoyed the mood here."
m/humanist_vampire_seeking_consenting_suicidal_person,Sharai Bohannon,FALSE,Horror Movie Blog,Fresh,6/27/2024,'Humanist Vampire Seeking Consenting Suicidal Person' is possibly the cutest movie you could ask for this year.
m/humanist_vampire_seeking_consenting_suicidal_person,Miyako Pleines,FALSE,Spectrum Culture,Fresh,6/26/2024,An interesting premise shepherded by a talented cast that is sure to live on for some time.
m/humanist_vampire_seeking_consenting_suicidal_person,Stephanie Malone,FALSE,Morbidly Beautiful,Fresh,6/23/2024,"Humanist Vampire is a gorgeous gothic treat that takes a tender and thoughtful approach to the subgenre. Genre lovers who appreciate humorous and heartfelt love letters to classic horror should find much to appreciate in this funny, feel-good romp."
m/humanist_vampire_seeking_consenting_suicidal_person,Rendy Jones,TRUE,RogerEbert.com,Fresh,6/22/2024,"A charming, dark, comedic romp for a new generation that is a welcoming new branch to the vampire cinema tree."
m/humanist_vampire_seeking_consenting_suicidal_person,Rafaela Sales Ross,FALSE,IGN Movies,Fresh,6/21/2024,The film is less concerned with gore than it is with the big questions of being a vampire in the era of sensitive teens and the politically correct. But it still plays out as a highly fun and entertaining entry to the bloodsucker canon.
m/humanist_vampire_seeking_consenting_suicidal_person,Meagan Navarro,TRUE,Bloody Disgusting,Fresh,6/21/2024,"It's a stylish, cute date night feature, as fangless and lovely as its central vampire."
m/humanist_vampire_seeking_consenting_suicidal_person,Coleman Spilde,FALSE,The Daily Beast,Fresh,6/21/2024,Louis-Seize's film is an inviting coming-of-age tale about how a vampire gets by when she's not inclined to kill.
m/humanist_vampire_seeking_consenting_suicidal_person,Andy Crump,FALSE,Paste Magazine,Fresh,6/21/2024,"Humanist Vampire Seeking Consenting Suicidal Person, is not only packing one of 2024's standout titles; it's the most original vampire film of the 2020s so far."
m/humanist_vampire_seeking_consenting_suicidal_person,Mark Dujsik,FALSE,Mark Reviews Movies,Rotten,6/21/2024,"The title is more evocative and provocative than anything in co-writer/director Ariane Louis-Seize's movie, unfortunately."
