rotten_tomatoes_link,critic_name,top_critic,publisher_name,review_type,review_date,review_content
m/morbius,Collin Garbarino,FALSE,WORLD,Rotten,4/8/2022,"These kinds of movies are supposed to be morality tales in which the protagonist comes to a tragic end. But a tragic end cant become a franchise, so Morbius flinches from its necessary conclusion, leaving an already confused movie without a payoff."
m/morbius,Louisa Moore,FALSE,Screen Zealots,Fresh,4/8/2022,"Doesn't deliver a lot of high notes, but it's not unwatchable (especially if you enjoy the vampire genre). Morbius is not as great as you'd hoped, but not as bad as you feared."
m/morbius,Nick Johnston,FALSE,Vanyaland,Rotten,4/8/2022,There's such little meat on the bone here plot-wise that it feels like everyone involved in the production got a checklist of beats that the studio wanted to hit and did their best to make that all that they did.
m/morbius,Olivia Gacka,FALSE,SciFiNow,Fresh,4/7/2022,"Overall, this is an entertaining movie. It sucks you in with the action and standout scenes between some of the characters. But, while Morbius has the makings of a great anti-hero revival, it wavers with the execution."
m/morbius,Jeremy Aspinall,FALSE,Radio Times,Rotten,4/7/2022,"Sadly, director Daniel Espinosa's action horror is itself drained of atmosphere, shocks and drama."
m/morbius,Daniel M. Kimmel,FALSE,North Shore Movies,Fresh,4/7/2022,Like the Venom films and unlike the MCU movies Morbius eschews the mythmaking of the Avengers for darkly comic horror.
m/morbius,Emmanuel Noisette,FALSE,The Movie Blog,Rotten,4/7/2022,Morbius is an incoherent and unoriginal film that doesn't make the best use of Jared Leto's talents.
m/morbius,Bennett Campbell Ferguson,FALSE,Willamette Week,Rotten,4/7/2022,"Jared Leto has been exquisitely vulnerable (Requiem for a Dream), exquisitely sinister (Blade Runner 2049) and exquisitely ridiculous (House of Gucci). Yet in Morbius, he's something he's never been before: disastrously dull."
m/morbius,Allen Adams,FALSE,The Maine Edge,Rotten,4/7/2022,"A mishmash of shoddy-looking effects work and oddball creative choices, a melange of nonsense that could have been somewhat forgiven if the movie was any fun ... but it isn't. In short, Morbius kind of sucks."
m/morbius,Richard Whittaker,TRUE,Austin Chronicle,Rotten,4/7/2022,"So many choices... just seem halfhearted. They're not terrible, but they're also not interesting."
m/morbius,Peter Hoskin,FALSE,Daily Mail (UK),Fresh,4/7/2022,"I'd gone into Morbius expecting a throwaway comicbook movie, but the director Daniel Espinosa and writers Matt Sazama and Burk Sharpless seem to have higher aspirations."
m/morbius,Rachel Wagner,FALSE,rachelsreviews.net,Rotten,4/7/2022,"It is dull and generic which is a real shame because the cast is talented and the premise has potential to be weird and exciting. In the end, its just forgettable."
m/morbius,Ian Simmons,FALSE,Kicking the Seat,Fresh,4/6/2022,"The further I get from it, the more its flaws seem crippling, but I admire the spirit that Espinosa and company brought to the project, which, Im convinced, was nearly destroyed by a meddlesome and cowardly studio."
m/morbius,Amanda Mazzillo,FALSE,Film Joy,Rotten,4/5/2022,"Morbius sometimes works great, but these memorable moments are spaced too sporadically throughout the film. It's worth watching to see the delightful performance from Matt Smith, who perfectly balances the campiest moments with the most emotional."
m/morbius,Brad Gullickson,FALSE,Film School Rejects,Rotten,4/5/2022,"Its hard to say if Morbius was doomed from the start, but after years of anticipating its tepid arrival, the final film earns a yawn as large as its protagonists unhinged snarl."
m/morbius,Jason Shawhan,FALSE,Nashville Scene,Rotten,4/5/2022,"Its unfair, but mostly accurate, to call Morbius a speed bump in the trajectory of comic book films."
m/morbius,Susan Granger,FALSE,SSG Syndicate,Rotten,4/5/2022,Ghoulish Gothic gloom....
m/morbius,Andy Lea,FALSE,Daily Express (UK),Rotten,4/5/2022,"Here's Jared Leto, ditched from the DC Extended Universe for his hammy take on The Joker, starring in his first solo movie for Marvel. It's the dullest film to ever carry that flickering logo."
m/morbius,Tim Brayton,FALSE,Alternate Ending,Rotten,4/5/2022,"Just plain miserable to sit through, offering almost nothing pleasurable either ironically or unironically."
m/morbius,Kevin A. Ranson,FALSE,MovieCrypt.com,Rotten,4/4/2022,"... we know where its been, where its going, and theres zero emotional impact when we get there without a hint of a denouement... a total DC-MurderVerse move to computer-animate the entire final battle climax..."
m/morbius,Mel Valentin,FALSE,That Shelf,Rotten,4/4/2022,"An often bored-looking Leto isnt helped by a formulaic, generic, cliche-ridden screenplay credited to Matt Sazama and Burk Sharpless. Anonymous, borderline competent direction comes thanks to Swedish-born Daniel Espinosas (Life, Safe House) ..."
m/morbius,Tori Preston,FALSE,Pajiba,Rotten,4/4/2022,Ultimately I'll say that the movie wasn't the trainwreck I was expecting... But I'd rather see a flaming disaster from a team of passionate creatives than a sanitized jigsaw puzzle assembled by a board of directors any day.
m/morbius,Esther Zuckerman,TRUE,Thrillist,Rotten,4/4/2022,"Like most April Fools' Day jokes, Morbius is not actually funny. It's not bad in the ha ha you have to see this it's so ridiculous kind of way. It just feels underbaked and lame -- and, sadly, not weird enough to be any kind of fun."
m/morbius,Micheal Compton,FALSE,Bowling Green Daily News,Rotten,4/4/2022,"As comic book movies go it's overwhelmingly underwhelming, a lifeless carcass of a film that serves its immediate purpose but inspires zero desire to have this character's story continue in future films."
m/morbius,Kyle Smith,FALSE,National Review,Rotten,4/4/2022,"Alas, the total quantity of wit in this movie is to a soupçon what Jared Leto is to Daniel Day-Lewis."
m/morbius,Sheraz Farooqi,FALSE,CinemaDebate,Rotten,4/4/2022,"Morbius ultimately feels less than the sum of its parts. While there might have been a good movie somewhere pre-reshoots, the film never finds its footing. That said, it's not nearly as bad as others pre-decided it would be."
m/morbius,Matthew Bond,FALSE,The Mail on Sunday (UK),Rotten,4/4/2022,"Morbius is dreadful, quite possibly the worst example of the comic-book, super-hero genre I've ever seen."
m/morbius,Wendy Ide,TRUE,Observer (UK),Rotten,4/4/2022,"[An] incoherent, vampire-themed Marvel offcut."
m/morbius,Edward Porter,FALSE,Sunday Times (UK),Rotten,4/4/2022,Leto is smoothly charismatic but is given nothing of interest to do.
m/morbius,Alci Rengifo,FALSE,Entertainment Voice,Rotten,4/4/2022,A blood-sucking example of why not everything ever published by Marvel Comics deserves a movie.
m/morbius,James Berardinelli,FALSE,ReelViews,Rotten,4/3/2022,"Despite only being a little over 90 minutes long, Morbius is a chore to sit through. It lacks imagination, zest, and a thrill of discovery."
m/morbius,Mark Meszoros,FALSE,"The News-Herald (Willoughby, OH)",Fresh,4/3/2022,Morbius is a surprisingly solid building block for Sony as it looks to expand its universe of heroes and villains.
m/morbius,Mathew DeKinder,FALSE,Mat's Entertainment,Rotten,4/3/2022,Morbius internal conflict is brushed aside and the movies central theme is abandoned and forgotten in a chaotic mass of special effects and a mad rush to set up more sequels.
m/morbius,Martin Tsai,FALSE,New York Sun,Rotten,4/3/2022,"Take the legacy character out of the equation, and this is virtually indistinguishable from any garden-variety horrorthriller released in the post-Oscars dumping ground."
m/morbius,Emma Kiely,FALSE,Collider,Rotten,4/2/2022,"Finally, a full year after its initial release date, it is finally seeing the light of day. And let me be the one to say: I could have happily waited another decade."
m/morbius,James Hanton,FALSE,Outtake Mag,Rotten,4/2/2022,"Between the lack of atmosphere, underdeveloped characters and questionable visuals, Morbius just doesnt know how to hold its audiences attention."
m/morbius,Preston Barta,FALSE,Denton Record-Chronicle,Fresh,4/2/2022,"Jared Leto trades in his clown shoes for fangs and, of course, its as silly and bad as you thought. However, its never not entertaining, and Matt Smith understood the assignment."
m/morbius,John Urbancich,FALSE,JMuvies,Rotten,4/2/2022,"Occasionally, it's not as ghastly as it might sound, mostly thanks to Leto's general gravitas and a supervillain (Matt Smith from The Crown) thoroughly enjoying his own personal discoveries."
m/morbius,Lisa Johnson Mandell,FALSE,AtHomeInHollywood.com,Rotten,4/2/2022,"Its a bit like a hastily and inexpertly assembled jigsaw puzzle. While the overall picture is obvious, the individual pieces dont fit into place, and after awhile, you stop caring."
m/morbius,Andre Hereford,FALSE,"Metro Weekly (Washington, DC)",Rotten,4/2/2022,"The misfiring Morbius at a certain point just stops firing, but not before it stops making sense."
m/morbius,Eddie Harrison,FALSE,film-authority.com,Rotten,4/2/2022,"...despite aspirations to Cronenbergian body-horror, Morbius' bloody action amounts to a lengthy thin-off between Leto and Smith..."
m/morbius,Noah Berlatsky,FALSE,NBC News THINK,Rotten,4/2/2022,"Although Dracula has long represented the outsider, Morbius spends the whole film trying to be more normal."
m/morbius,Lynn Venhaus,FALSE,Webster-Kirkwood Times,Fresh,4/1/2022,"More horror than hero, Morbius is as dark and brooding as The Batman, but with less style and substance. Yet, the themes and origin story are intriguing, and a different product than routine Marvel comic books-turned-movies."
m/morbius,Felix Vasquez Jr.,FALSE,Cinema Crazed,Rotten,4/1/2022,"A painfully boring, listless, tedious (slightly ableist) horror action film that never quite knows where it wants to go..."
m/morbius,Peter Gray,FALSE,The AU Review,Rotten,4/1/2022,"In short, going for the vampiric pun youd expect, this sucks."
m/morbius,Ryan Syrek,FALSE,"The Reader (Omaha, NE)",Rotten,4/1/2022,"An interesting choice: Every fight sequence or use of superpowers in Morbius is done under a fart cloud. Some may say its vampire mist or puff of smoke, but I know a plume of flatulence when I see it."
m/morbius,Nestor Bentancor,FALSE,Nestor Cine Desde Hollywood,Fresh,4/1/2022,"A mediocre mixed bag of a 90s B movie that, despite its many flaws, represents an acceptable introduction to Jared Leto's anti-hero."
m/morbius,Steven Prokopy,FALSE,Third Coast Review,Rotten,4/1/2022,"At this point, I think it's fair to say that any comic book character that has even the most remote stink of Spider-Man on them is fair game for a film adaptation (I'm looking at you, Venom movies), whether they deserve one or not."
m/morbius,Patrick McDonald,FALSE,"WBGR-FM (93.7 FM - Monroe, WI)",Fresh,4/1/2022,"Geez everybody, calm down. There is an essential question about the bodily handicaps in the story, which gives it some heft ... what is one willing to give away to get cured of a disease thats essentially a living death? Disgust for drinking blood? Cool."
m/morbius,Damond Fudge,FALSE,"KCCI (Des Moines, IA)",Rotten,4/1/2022,Morbius comes across as a dull exercise in how not to maintain property rights or entertain an audience.
m/morbius,Jeffrey M. Anderson,FALSE,Common Sense Media,Rotten,4/1/2022,"Humorless and as flat and as uninspired as the Venom movies were, this by-the-numbers comic book action movie seems to be operating entirely on auto-pilot, ticking off plot boxes as it goes."
m/morbius,Alex Abad-Santos,TRUE,Vox,Rotten,4/1/2022,"Morbius's greater fault is that it cleaves away the vampire mythology without replacing that mythology with anything fun, new, or particularly interesting."
m/morbius,Mark Kennedy,TRUE,Associated Press,Rotten,4/1/2022,"Morbius is a forgettable, often laughable, entry in Sony's attempt to fill its own Spider-Man-adjacent cinematic universe, a poorly edited, derivative time suck -- pun intended."
m/morbius,Chelsea Steiner,FALSE,The Mary Sue,Rotten,4/1/2022,"The film's plot is lackluster, and there's no humor, no charm, and no warmth to be found. It's rare to see a film so devoid of style and ambition, that slugs along like a direct-to-video Underworld sequel."
m/morbius,Daniel Baksi,FALSE,The Arts Desk,Rotten,4/1/2022,Morbius joins the glaring disappointments of Suicide Squad and the yakuza drama The Outsider as the latest instalment in a hit-and-miss career.
m/morbius,Jim Judy,FALSE,Screen It!,Rotten,4/1/2022,"It would seem fairly difficult to make a boring vampire flick, let alone one tied to the Marvel universe, but here we have it. Yes, vampires suck, but so does this movie."
m/morbius,Christopher Lloyd,FALSE,The Film Yap,Fresh,4/1/2022,"Hardly the best in the superhero game, but a decently entertaining and moody entry that's hands down better than the lackluster Venom series."
m/morbius,Nate Adams,FALSE,The Only Critic,Rotten,4/1/2022,Sucks the fun out of everything.
m/morbius,Bilge Ebiri,TRUE,New York Magazine/Vulture,Fresh,4/1/2022,"Morbius has no reason to exist as an actual movie, but maybe that's why it worked for me."
m/morbius,Stephen Silver,FALSE,Tilt Magazine,Rotten,4/1/2022,"An all-around ill-conceived effort sporting a boring hero, an uninteresting villain, and probably the least-appealing visual style of any film this year."
m/morbius,Elias Savada,FALSE,Film International,Rotten,4/1/2022,A nonsensical FrankensteinDraculaJekyll & Hyde mashup from Marvel.
m/morbius,Caroline Siede,TRUE,Fox 10 Phoenix,Rotten,4/1/2022,"Alas, Morbius is too bound to comic book movie convention to become the overt gay vampire superhero melodrama it probably should have been."
m/morbius,Rick Marshall,FALSE,Digital Trends,Rotten,4/1/2022,"Morbius had every opportunity to be just as groundbreaking as that other Marvel vampire film was years ago, but instead it feels like just another nail in the coffin of Sonys Spider-verse."
m/morbius,James Verniere,FALSE,Boston Herald,Rotten,4/1/2022,"Leto tries to turn the biochemist-turned-vampire into a a character of Shakespearean proportion, but is tripped up by the weak, derivative screenplay."
m/morbius,Julian Lytle,FALSE,idobi.com,Fresh,4/1/2022,"Morbius is a throwback to a simpler and less sophisticated era of superhero movies. Its not terrible, great, or even so bad, its goodits just super average."
m/morbius,Dana Han-Klein,FALSE,We're Watching What?!,Rotten,4/1/2022,Morbius tries to drain the life out of you by boring you to death. It doesn't even do us the courtesy of being so bad it's good.
m/morbius,Andrea Chase,FALSE,Killer Movie Reviews,Rotten,4/1/2022,"Takes the earnest approach to its tale of a brilliant scientist making a grave error of judgment, and then presents it as a slog fraught with cliched tropes."
m/morbius,Sean Collier,FALSE,Pittsburgh Magazine,Rotten,4/1/2022,It is so consistently uninventive even apathetic that one cannot help but ask if anyone involved even considered the possibility that making a good movie was an option.
m/morbius,Chris Knight,FALSE,National Post,Fresh,4/1/2022,It's been far too long since I've seen a superhero movie whose special effects were both jaw-dropping and seemingly effortless.
m/morbius,Tom Santilli,FALSE,Movie Show Plus,Rotten,4/1/2022,"...when Jared Leto is the best part of your movie, you know you are in serious trouble."
m/morbius,Johnny Gayzmonic,FALSE,Fanboys of the Universe,Rotten,4/1/2022,The film wants the true conflict to be between Morbius and his vampire self. Will Morbius give in to his dark side?...Let me say this again: I. Do. Not. CARE.
m/morbius,Peter Travers,TRUE,ABC News,Rotten,4/1/2022,"Jared Leto goes the extra mile to bring a minor-league villain from Marvel Comics to the big screen, but this botched horrorfest about the so-called living vampire is less deserving of a sequel than a stake through its heart."
m/morbius,Mike McGranaghan,FALSE,Aisle Seat,Rotten,4/1/2022,Too many films like Morbius could hasten the death of superhero cinema.
m/morbius,Hanna Flint,FALSE,The Sun (UK),Rotten,4/1/2022,"The cast cannot elevate a bland, lifeless narrative with direction from Daniel Espinosa that fails to capture any of the romantic yearning and melancholy associated with vampires or the excitement of the superhero genre the world has grown to love."
m/morbius,Phil Villarreal,FALSE,ABC Tucson,Rotten,4/1/2022,"As disappointing as the movie may be, its post-credit sequence is even worse."
m/morbius,Matt Singer,TRUE,ScreenCrush,Rotten,4/1/2022,Are we sure this isn't some kind of elaborate April Fools Day prank?
m/morbius,Mark Feeney,TRUE,Boston Globe,Rotten,4/1/2022,"Even at 104 minutes, practically a short by superhero-movie standards, 'Morbius' feels draggy."
m/morbius,Sophie Butcher,TRUE,Empire Magazine,Rotten,4/1/2022,"Despite solid performances and flashes of promise, Morbius is a flat, forgettable affair, failing to deliver an anti-hero origin story we can really sink our teeth into."
m/morbius,M.V. Moorhead,FALSE,"Less Hat, Moorhead",Rotten,4/1/2022,"It has a truncated, cut-down feel to it, a suspicion supported by the presence of scenes in the trailer that didn't show up in the finished film."
m/morbius,Sonny Bunch,FALSE,The Bulwark,Rotten,4/1/2022,Morbius wasnt good: to begin with. There is no doubt whatever about that.
m/morbius,Miles Surrey,FALSE,The Ringer,Rotten,4/1/2022,Morbius's greatest legacy might be that it united the internet to dunk on a movie nobody asked for.
m/morbius,Bob Mondello,TRUE,NPR,Rotten,4/1/2022,"Merely adequate, and by Marvel standards, slightly anemic."
m/morbius,Jo Berry,FALSE,Movies4Kids,Rotten,4/1/2022,"The action sequences are forgettable, a blur of CGI punches and jumping sequences in which Morbius leaves a trail of streamy ribbons in his wake that are supposed to show his flight but instead look like the remnants of a retired cheerleaders pom-pom."
m/morbius,Lee McCoy,FALSE,DrumDums,Rotten,4/1/2022,It's impressive to live in a day and age where comic movies can still be this bad.
m/morbius,Sara Michelle Fetters,TRUE,MovieFreak.com,Rotten,4/1/2022,Morbius isn't a bad movie. It also isn't a particularly memorable one.
m/morbius,Marianna Neal,FALSE,Impression Blend,Rotten,4/1/2022,"When you combine bad dialogue, questionable editing, and a dead-serious tone - the result is not exactly great."
m/morbius,Aaron Neuwirth,FALSE,We Live Entertainment,Rotten,4/1/2022,"I may not have been a big fan of the Venom films, but it is easy to see their appeal. Hardy is putting his all into an off-the-wall dual performance...With that in mind, I would be hard-pressed to understand what Morbius has to offer."
m/morbius,Simon Foster,FALSE,Screen-Space,Fresh,4/1/2022,"It is almost a shame that Morbius is tied to the Marvel universe at all, given that the inclusion brings with it franchise expectations that don't serve the characters key traits at all."
m/morbius,Wenlei Ma,TRUE,News.com.au,Rotten,4/1/2022,"The script and direction is so bland that even Jared Leto couldn't inject any charm, menace or a skerrick of personality into the character."
m/morbius,Jeanne Kaplan,FALSE,Kaplan vs. Kaplan,Rotten,4/1/2022,Boring! And that's a death knell for anything coming out of Marvel Comic Universe.
m/morbius,David Kaplan,FALSE,Kaplan vs. Kaplan,Fresh,4/1/2022,"Other than being predictable with repetitive visual effects, I found MORBIUS intriguing."
m/morbius,Matt Conway,FALSE,Battle Royale With Cheese,Rotten,4/1/2022,Morbius delivers a toothless and aggressively soulless descent into beige superhero formula.
m/morbius,Russ Simmons,FALSE,KKFI-FM (Kansas City),Rotten,4/1/2022,"Its watchable, but the by-the-numbers execution leaves Morbius just a bit anemic."
m/morbius,Evan Dossey,FALSE,Midwest Film Journal,Rotten,4/1/2022,"Morbius caps off bad month for bat men, but at least it's weird enough to be occasionally enjoyable."
m/morbius,Korey Coleman,FALSE,Double Toasted,Rotten,4/1/2022,Morbius is like a can of flat soda.
m/morbius,Michael Gingold,FALSE,Rue Morgue Magazine,Rotten,4/1/2022,"There's a decided B-movie feel hanging over the whole thing, no matter how much gratuitous CGI it throws at us. Simply put, this is not the preferred comics-based bat man to see on screens right now."
m/morbius,Jeremy Jahns,FALSE,JeremyJahns.com,Rotten,4/1/2022,A living vampire and a lifeless movie.
m/morbius,Rob Dean,FALSE,Bullz-Eye.com,Fresh,4/1/2022,"Morbius is a character whos caught between two worlds (man and monster), and his movie is stuck in a similar liminal space that ultimately makes it unremarkable."
m/morbius,Craig D. Lindsey,FALSE,Crooked Marquee,Rotten,4/1/2022,[A] lazy actioner so forced and derivative that it feels like it came out in 2002 rather than 2022.
m/morbius,David Sims,TRUE,The Atlantic,Rotten,4/1/2022,"Even by the standards of the many monotonous origin stories that have been rolled out during this superhero boom, Daniel Espinosa's film is a whiff."
m/morbius,Joshua Rivera,FALSE,Polygon,Rotten,4/1/2022,"If Instagram had a 'blockbuster' filter, this film would use it the whole time."
m/morbius,Doug Walker,FALSE,Channel Awesome,Fresh,4/1/2022,"Not the best written, but Jared Leto's surprisingly restrained performance mixed with Matt Smith's scenery chewing makes this a decent enough monster movie."
m/morbius,Tessa Smith,FALSE,Mama's Geeky,Rotten,4/1/2022,"Morbius is disjointed, rushed, poorly edited, and then it ends abruptly with viewers just kind of staring at their screen wondering what just happened."
m/morbius,Jake Wilson,TRUE,The Age (Australia),Rotten,4/1/2022,"Over the years, there have been plenty of mediocre movies associated with the Marvel brand, but I can't recall one so blatantly willing to leave viewers shortchanged."
m/morbius,Robert Daniels,TRUE,Los Angeles Times,Rotten,4/1/2022,This movie is also devoid of depth. It is emblematic of a system that places amusement park wonderment above sturdy storytelling.
m/morbius,Sebastian Zavala Kahn,FALSE,Me gusta el cine,Rotten,3/31/2022,"It starts well, builds to some promise, but ends incredibly clumsily, wasting the likes of Jared Harris (super underrated), Adria Arjona (who has excelled on shows like Good Omens), and yes, believe it or not, even Tyrese."
m/morbius,Fico Cangiano,FALSE,CineXpress,Rotten,3/31/2022,"Not good. It includes a weak story, stale performances, and jerky action and editing. Serves as a reminder of what a disappointing superherocomic film looks like. Full review in Spanish"
m/morbius,J. Don Birnam,FALSE,Below the Line,Rotten,3/31/2022,"It's as disorienting as a Moebius strip--the effects erase the characters and nearly the entire picture, the script does not care to explain characters or plots, and all we are left with is yet another Spider-Man villain who in reality is a nice guy"
m/morbius,Richard Trenholm,FALSE,CNET,Rotten,3/31/2022,"Jared Leto stars as a sulking, skulking vampire in a bloodless and boring comics adaptation desperately riding the coat-tails of the Marvel movie powerhouse."
m/morbius,Hayden Mears,FALSE,Starburst,Rotten,3/31/2022,"It's ultimately easier to think of Morbius as a campy, marginally entertaining one-off rather than the franchise-starter it so obviously tries to be."
m/morbius,Sam Stone,FALSE,CBR,Rotten,3/31/2022,"Morbius hits the ground running, but the Living Vampire movie is ultimately an uneven film that never quite figures out what it wants to be."
m/morbius,Emily Zemler,TRUE,Observer,Rotten,3/31/2022,"Unless your ticket is free, don't bother. This movie is as lifeless as the bodies Morbius drains and throws on the floor."
m/morbius,Robert Kojder,FALSE,Flickering Myth,Rotten,3/31/2022,"Apparently, the early 2000 days of insultingly lazy superhero movies have not yet died out"
m/morbius,Alex Bentley,FALSE,CultureMap,Fresh,3/31/2022,"Morbius is a good-enough introduction for a character who most viewers may not know well. Its not spectacular entertainment like the Spider-Man movies, but neither will it have viewers wishing for their money back."
m/morbius,Manohla Dargis,TRUE,New York Times,Fresh,3/31/2022,"While most of it is as predictably familiar as expected, it does something unusual for a movie like this: It entertains you, rather than bludgeons you into submission."
m/morbius,Lupe Rodriguez Haas,FALSE,CineMovie.tv,Rotten,3/31/2022,"The film is just another vampire movie rather than an origins Marvel story. With a predictable plot, inconsistent beats, flat dialogue and bland characters, Morbius is a huge letdown. The post credits feel like a sloppy afterthought."
m/morbius,Robin Clifford,FALSE,Reeling Reviews,Rotten,3/31/2022,"I know that the fans will spend their time and money to see the latest Spidey-verse version entry and more power to them. But, for everyone else without that fandom fervor, why bother?"
m/morbius,Brian Lowry,TRUE,CNN.com,Fresh,3/31/2022,"Significantly better than Venom but still somewhat lacking in bite, this origin story perhaps inevitably grows more pallid toward the end but until then proves just tasty enough to merit the giving it a shot."
m/morbius,Adam Graham,TRUE,Detroit News,Rotten,3/31/2022,There's nothing in Morbius that couldn't have been better summed up in a two-minute trailer.
m/morbius,MontiLee Stormer,FALSE,MovieReelist.com,Fresh,3/31/2022,"I'm not gonna lie, it's difficult to watch the Joker and the Eleventh Doctor battle it out on-screen with teeth and claws, but Morbius manages to make it work. It's not a movie everyone will love, but don't dismiss it just yet"
m/morbius,Leslie Felperin,TRUE,Financial Times,Rotten,3/31/2022,You can only imagine the carnage that must have taken place in the edit suite.
m/morbius,Hannah Strong,TRUE,Little White Lies,Rotten,3/31/2022,"Soulless, tedious filmmaking. The doldrums of superhero theatrics."
